{
  "$schema": "https://json-schema.org/draft/2020-12/schema",
  "$id": "https://github.com/Seungpyo1007/KoreaPoliticsAPI/schema/office.json",
  "type": "object",
  "required": ["id", "type", "name", "source_urls", "verified", "checked_at"],
  "additionalProperties": false,
  "properties": {
    "id": { "$ref": "common.json#/$defs/id" },
    "type": { "$ref": "common.json#/$defs/office_type" },
    "name": { "$ref": "common.json#/$defs/text" },
    "sido": { "$ref": "common.json#/$defs/text" },
    "seats": { "type": "integer", "minimum": 2 },
    "source_urls": { "$ref": "common.json#/$defs/source_urls" },
    "verified": { "$ref": "common.json#/$defs/verified" },
    "checked_at": { "$ref": "common.json#/$defs/checked_at" },
    "note": { "$ref": "common.json#/$defs/note" },
    "withdrawn": { "$ref": "common.json#/$defs/withdrawn" },
    "withdrawn_reason": { "$ref": "common.json#/$defs/withdrawn_reason" }
  }
}
