{
  "id": "proportional-16",
  "type": "assembly",
  "name": "비례대표",
  "seats": 46,
  "source_urls": [
    "https://open.assembly.go.kr/portal/data/service/selectServicePage.do/OAJPOY0010182J19421",
    "https://open.assembly.go.kr/portal/data/service/selectServicePage.do/OD21030011944P19666"
  ],
  "verified": false,
  "checked_at": "2026-10-22",
  "note": "제16대 국회. seats는 국회 의원이력에서 같은 날 함께 재직한 최대 인원"
}
